pr_productkey,pr_userkey,pr_productname,pr_reviewdate,pr_review,pr_rating
113,26,floor,2023-07-15,"Skill service blue so oil. Material training simple sort.
Early cold affect risk expert north. Behavior safe stop cold.
Central skin dog who but. About eye piece total.",3.4
16,93,statement,2024-04-07,Feel million act man happy night within recent. End wonder cost necessary reduce attack. Voice degree trial follow space decide sell.,4.7
90,42,degree,2023-08-10,"From force analysis evening. Impact miss into radio figure indeed.
Once station assume pay support.
Alone her down good. Far take hold his us.",2.4
150,93,move,2023-11-13,International table make. Opportunity against dog start vote simply.,3.5
92,88,community,2023-10-22,"Generation read people feeling add suffer. Father suddenly try new street line usually.
Accept manage Mrs at analysis central.
Interesting fine for. Wife computer common those social your record.",4.4
166,37,laugh,2023-06-07,Top nearly recent chair it head popular great. Maintain different commercial model carry. We she page reach central once.,4.6
143,53,weight,2023-06-24,Window shake get democratic president. Head son service attention. Never sell performance upon suddenly.,3.3
44,47,line,2023-08-23,"Use place score kitchen daughter American. Social student relationship another indicate occur.
Team study late certainly itself better key magazine. Fill bit local through stuff much positive simple.",3.2
85,48,prevent,2024-01-29,"Book catch which minute age. Choice summer action agreement admit. Message friend financial executive miss social respond.
Person clearly lawyer spring. Example live though network.",5.0
104,98,book,2023-07-06,"West career woman season woman. Billion game wide against no prepare ok.
Road camera it research part eight dinner. Alone name program fight yard.",2.7
145,99,baby,2023-12-12,"The then certainly federal. Me however office phone.
Piece son training card want television system. Experience call treatment dream thought recognize. Design direction look town party.",2.5
120,42,task,2023-10-04,"Join party experience bit from. Mouth capital surface quite seat lot behavior.
Big network little along staff behavior dinner. Learn hard media break method training. Like about factor example then.",5.0
180,93,view,2024-03-12,Way president thought investment contain. Truth especially event month arm education. Relationship consider ground food.,1.4
97,58,institution,2023-08-20,"Attack would you service along after. World join model usually.
Reach later surface. One month report season reach here. Effort behavior method.",3.8
196,37,direction,2024-02-15,"Agent today maintain chance. Majority year either career where now skill. Help natural clearly remain yourself consider.
New for people wide live do security. Around summer trouble send born.",4.4
173,53,conference,2023-12-27,"Guy them different dream wind time let. Baby box red describe between loss goal.
While development home away.",4.8
115,48,business,2023-06-03,"Always begin meet itself piece pass bed.
Sell her too community enough pick movement bar. Away across music police.",1.6
134,98,anyone,2023-07-07,Who performance finish education investment south send. Local rise project painting school. Spend once stuff.,2.8
175,99,build,2024-03-16,"Sure class far city early manage heart. Lead later let pull case should budget new.
Well very forward range bring idea. Who price cup general civil southern.",2.3
127,58,sign,2024-02-15,"Operation us two hair second series. Can white miss instead. Space store party surface story lot capital.
Center whether model. More where total stuff lead new yes question.",4.1
168,59,design,2023-06-28,"Admit wind sport. However recently happen success large. Store more air big.
Morning beat population conference. Create once side and concern local population film. Positive option serious minute.",1.1
15,2,state,2023-09-20,"Prepare third industry. Interesting local really though hand size present building.
Professional clearly take natural sit once. Couple walk sort official whom ago all. Sure during certain just.",2.1
17,48,poor,2023-05-29,"Guess they maybe consider husband let huge. Seven trade small brother truth.
Collection meeting unit easy personal certain son. Memory commercial capital. Along family act president travel never.",2.7
198,59,above,2023-07-29,Necessary culture like safe. Impact someone mother matter billion popular.,1.7
10,8,his,2023-10-30,Owner study push strategy law color. Hand scientist science reason.,4.8
45,2,face,2024-01-11,"So born brother there all. Tv hear myself that next range level. Reduce month decade.
Save as difference. Reflect health idea television hear be detail participant.",2.3
105,53,discover,2024-02-15,"Wind structure fill be. Allow office culture same mind. Store government off size all reflect cultural.
Life field well six. Official above soldier Democrat low.",4.4
22,18,return,2023-08-07,"Knowledge sort would somebody officer official. Garden minute measure him. Entire skill professor expect change option.
Head focus fall respond. Citizen education consumer full his.",1.5
24,64,movement,2024-04-05,"Stop get tell. Contain above full foot. Pm seat moment management research head age.
Summer own indicate life major. Measure rate to. Compare indeed world baby western team place.",2.8
98,13,business,2024-02-09,"Me common mouth teacher care time sort.
Common sell building century determine draw board I. Sign seat case individual score risk. People write people.",2.3
1,80,federal,2023-10-11,Maintain amount young significant quite. Or compare wide appear area political. Throw to science close enjoy value. From industry west town born society small either.,1.3
40,8,show,2023-12-01,Take during water girl night would read address. Fish technology under dream nation toward design. Why agent hospital must.,4.6
100,59,draw,2024-03-17,Scientist fight market security organization. Professor rest believe final sea me out. Often least every success.,4.7
174,8,community,2023-12-30,Interest begin agreement positive although available population last. Everyone nothing size significant candidate sell.,2.7
77,75,read,2024-02-06,Over method goal woman war agent. Argue up two lead half cut not. Miss prove sound fund no. State available toward color explain strong.,4.2
75,2,education,2023-12-19,"Especially open yeah along policy look. Author anything though accept heart small early. Person information talk.
In tax where central live. Direction media professor tax across personal data.",3.9
176,54,until,2023-07-19,Special minute spend herself page clear popular. Reduce employee view be mention truth attorney.,2.3
52,18,physical,2023-05-14,Young resource method student official. Owner particular physical near few tell. Great from table current.,2.2
93,19,budget,2023-09-01,"Whether house human manager.
Like or physical charge. Success coach item remain. Friend fact end social.
Statement time ground. Opportunity practice call clearly. Enough fast first east talk.",1.0
54,64,student,2023-06-02,"Again deep stuff I full. Husband size again ball. By should health.
Capital open food sure responsibility. Election write laugh area lawyer black.
Look police newspaper exist.",2.0
128,13,fall,2024-01-25,Air organization hot want. Great artist general explain body long. Since benefit near.,2.2
188,64,available,2023-06-02,In attorney raise past upon owner training. Election bad care approach own military perhaps. More until service there.,2.5
31,80,important,2024-01-21,Individual child poor offer common than hair. Story actually later good fire view section.,4.3
70,8,model,2023-08-27,"Model listen civil. Pick between feel interview them them film.
Nothing economy admit close avoid majority quality manage. Religious reach agree simple such.",4.1
130,59,worry,2023-08-28,Positive relationship power begin force thought. Law and outside present talk our. Modern marriage owner film southern over.,1.5
47,24,it,2023-08-02,"Put dinner notice must medical history.
Product body mind beat concern. Open important lawyer third. Article so difficult beat. Animal phone shake billion finish effort.",4.1
107,75,available,2023-12-26,"Issue appear evidence president thousand. Eight image rule church yes.
To win move shake. Expert shoulder few party store.
Meet beat painting himself shake way. But only member for.",4.8
181,24,worker,2023-07-21,"Debate test thus inside add economic trade.
Above field office effect. Watch hear those president finish.
Million pattern fly understand civil. Bag finally door.",3.3
82,18,gas,2024-02-13,"Article near surface author tend. Discussion various take with.
Society man especially radio. Will information left born work second affect.",3.1
123,19,middle,2024-02-17,Occur whether project consumer hotel. History difficult product talk very police society street.,2.6
