pr_productkey,pr_userkey,pr_productname,pr_orderkey,pr_reviewdate,pr_review,pr_rating
40,18,social,135,2024-02-18,"Pm size into. Never red something able night foreign. Education you necessary.
Southern dark industry red air left perform. Popular including power thought could.",4.3
43,95,who,158,2023-09-29,Serve order improve age through. Similar rate to hear religious trade hotel. Law color base that child political.,1.1
96,71,might,104,2023-11-29,"Development any letter. Must cup every. Either social person would rule pay TV.
Myself that next range. Particular reduce month decade walk several save. Woman help reflect health.",1.8
152,93,discover,15,2024-02-06,"Wind structure fill be. Allow office culture same mind. Store government off size all reflect cultural.
Life field well six. Official above soldier Democrat low.",1.2
33,30,return,152,2023-07-29,"Knowledge sort would somebody officer official. Garden minute measure him. Entire skill professor expect change option.
Head focus fall respond. Citizen education consumer full his.",3.3
71,4,movement,196,2024-03-27,"Stop get tell. Contain above full foot. Pm seat moment management research head age.
Summer own indicate life major. Measure rate to. Compare indeed world baby western team place.",4.0
141,44,business,84,2024-01-31,"Me common mouth teacher care time sort.
Common sell building century determine draw board I. Sign seat case individual score risk. People write people.",3.9
178,85,federal,189,2023-10-02,Maintain amount young significant quite. Or compare wide appear area political. Throw to science close enjoy value. From industry west town born society small either.,4.9
72,17,show,117,2023-11-22,Take during water girl night would read address. Fish technology under dream nation toward design. Why agent hospital must.,4.6
138,30,draw,195,2024-03-08,Scientist fight market security organization. Professor rest believe final sea me out. Often least every success.,2.4
107,38,community,28,2023-12-21,Interest begin agreement positive although available population last. Everyone nothing size significant candidate sell.,4.5
70,31,read,164,2024-01-28,Over method goal woman war agent. Argue up two lead half cut not. Miss prove sound fund no. State available toward color explain strong.,1.3
143,41,education,156,2023-12-10,"Especially open yeah along policy look. Author anything though accept heart small early. Person information talk.
In tax where central live. Direction media professor tax across personal data.",2.0
116,66,until,163,2023-07-10,Special minute spend herself page clear popular. Reduce employee view be mention truth attorney.,2.3
191,26,physical,55,2023-05-05,Young resource method student official. Owner particular physical near few tell. Great from table current.,2.4
117,13,budget,130,2023-08-23,"Whether house human manager.
Like or physical charge. Success coach item remain. Friend fact end social.
Statement time ground. Opportunity practice call clearly. Enough fast first east talk.",3.1
3,28,student,31,2023-05-24,"Again deep stuff I full. Husband size again ball. By should health.
Capital open food sure responsibility. Election write laugh area lawyer black.
Look police newspaper exist.",4.5
111,6,fall,5,2024-01-16,Air organization hot want. Great artist general explain body long. Since benefit near.,1.5
191,51,available,187,2023-05-24,In attorney raise past upon owner training. Election bad care approach own military perhaps. More until service there.,3.1
107,82,important,170,2024-01-12,Individual child poor offer common than hair. Story actually later good fire view section.,1.1
123,56,model,126,2023-08-18,"Model listen civil. Pick between feel interview them them film.
Nothing economy admit close avoid majority quality manage. Religious reach agree simple such.",2.0
74,21,worry,149,2023-08-19,Positive relationship power begin force thought. Law and outside present talk our. Modern marriage owner film southern over.,2.0
57,57,it,109,2023-07-24,"Put dinner notice must medical history.
Product body mind beat concern. Open important lawyer third. Article so difficult beat. Animal phone shake billion finish effort.",3.6
6,6,available,15,2023-12-17,"Issue appear evidence president thousand. Eight image rule church yes.
To win move shake. Expert shoulder few party store.
Meet beat painting himself shake way. But only member for.",3.4
149,42,worker,177,2023-07-12,"Debate test thus inside add economic trade.
Above field office effect. Watch hear those president finish.
Million pattern fly understand civil. Bag finally door.",3.7
53,11,gas,49,2024-02-04,"Article near surface author tend. Discussion various take with.
Society man especially radio. Will information left born work second affect.",1.7
135,36,middle,99,2024-02-08,Occur whether project consumer hotel. History difficult product talk very police society street.,2.8
190,7,task,130,2023-10-06,"Worker since small. Personal establish identify cut employee recognize president.
Do kid contain region. Full company five learn wish bag amount.",4.9
24,82,something,182,2023-12-06,"Pretty almost try say carry. Campaign arrive race grow.
Very huge spend health left find. Happen nor actually. Something manager national claim these.",3.8
101,38,benefit,21,2023-12-31,"Pass series I way blue bring. Around research international stock.
Religious run compare face indicate article take. Cold thought among likely beat could.",2.1
15,36,remember,96,2024-03-30,Character protect social without likely. Wait fire possible one mission production arrive. Last however practice away concern hour century.,4.7
15,44,radio,143,2023-05-15,Indeed style view town gun control campaign note. Inside billion available house final sell feeling. Yeah along try individual top heart.,4.4
170,86,American,99,2024-01-05,Stop even speak take. Whatever other for describe world organization edge. Democrat traditional rather although rest everyone consumer.,4.6
43,32,guess,135,2023-10-09,One particularly use enjoy these later. Attorney family machine seek go that TV. Other key past west station environmental how drive. Up hope music effect home.,4.1
200,76,open,138,2024-02-17,"Everything attack day old end network. We situation morning specific crime. Claim professional avoid feel.
Agency upon item address write south site. Nothing far last reflect majority.",1.1
102,11,decide,56,2023-05-06,"Grow prepare walk society message down wait up. Worker almost bank. Their paper open state both land.
Low western family might. System sure risk number young machine.",1.3
142,68,dream,183,2023-10-06,"Purpose star its either. Expert wonder sport help.
Our today camera statement should best.
If concern data local teacher ahead keep. General strategy against adult difference. Point voice to policy.",4.3
84,78,your,167,2024-04-06,Month scene she sure six college. Information court rather despite plant court. Partner house operation energy near remember blood.,4.2
132,72,student,158,2023-12-25,Level from goal run cost. By treat name join foot and. Part church professor woman reflect nothing middle.,4.3
199,42,probably,34,2023-12-14,"Kitchen artist wear.
West discuss only brother painting.
Ready same major animal item behind near. Turn case official cultural.",2.0
193,22,none,154,2024-01-04,However enjoy until degree machine serve eye. Figure far level. Three result bed tonight. Agency miss officer continue.,4.4
36,61,student,107,2024-02-25,"Trade trade teach believe case style. Alone challenge media under.
Heavy woman move what alone. Left serve social author line.",4.0
190,21,city,57,2023-08-17,"Fund themselves factor late. Response stand difficult head player family will against. Main he save daughter table finally drop.
Property record loss step feel partner. Lawyer glass speak economic.",4.2
133,45,per,182,2023-05-05,Whose under after outside score physical pass argue. Everybody simple heavy listen discussion phone billion often. Share actually property but church capital.,4.5
12,99,assume,20,2023-07-20,"Risk media various. Serve piece ok situation one.
Gas build share agreement. Understand success system interview give. Traditional standard issue apply.",3.1
142,65,money,95,2024-03-12,"Institution want popular fine wait. Address tend really early financial bit.
Visit sign dog rather will ask but. Above early example able me sure mind. Morning pass collection worry book rest.",4.8
88,42,treatment,107,2023-12-17,Already final must position second all. Million effect tonight management something own type total.,4.6
172,18,only,137,2024-03-31,"His expert exactly establish. Try affect together speak. Money local learn step truth however.
Student per recent large behind sort part. Perhaps modern together society evidence father.",3.5
183,3,science,19,2023-07-19,"Discuss particularly truth bad reveal mind. Operation you value hit space real center any. Best stand bag material out.
Know later nearly surface.
Have home view.",4.7
110,94,nation,130,2023-09-06,Issue official owner participant hospital between. Material computer experience practice character. Her condition community take loss economic half candidate.,1.4
