"0","23","Which good fall","4726","2006-10-09 00:45:27","Mouth third economy both morning themselves party crime no offer born decade evidence hard protect act herself this","0.0"
"1","6","Town all evening","2547","2000-01-19 11:24:34","Doctor lawyer player course next phone very hair under paper size while budget seven after","3.2"
"2","260","Vote first usually","1419","2000-08-21 17:02:23","Sea day challenge Congress individual north I try she safe building score mean claim serious name assume she rate great","3.2"
"3","124","Power hot student technology","1433","1975-01-08 20:58:09","Plan suggest now third benefit which wall face behind total season compare tonight blue strategy bit technology hundred such miss","1.3"
"4","151","Describe current seem usually","4957","2002-02-26 14:07:04","His personal billion gun chair clearly play north respond director response foreign at determine grow lawyer ever drive foreign someone","4.6"
"5","378","Data parent me unit","1300","1970-12-26 15:24:45","Call carry sound station property model activity very race","2.6"
"6","256","Only way","3948","1989-02-17 17:45:39","Economy process drug position themselves window not girl several speak","4.6"
"7","383","Edge hundred","3323","1998-06-19 21:04:55","Newspaper laugh along fight view religious kid least situation design media direction both while wrong law east","1.6"
"8","38","Work gun what PM","4568","1991-03-08 11:16:00","Ask someone argue become admit radio write skill fast","3.2"
"9","191","According the before against","4666","1994-11-23 18:59:50","Song relationship direction strong less safe fight source local","0.7"
"10","40","Month interest continue bank similar","1334","2022-01-30 12:35:39","Before age eight charge add art bank mean fund involve policy program visit government table others","1.1"
"11","390","Task worry","580","1971-07-03 17:33:23","Land person product quickly half cover own president car","4.3"
"12","402","Nature idea night","4859","1999-06-28 23:38:20","Drug find consumer write treat drive court management pay write it senior","3.1"
"13","463","Check person","4721","1990-09-16 15:31:28","Large everything upon main benefit pull hand who enter","0.9"
"14","422","Later where","4005","1970-12-26 15:23:56","Especially tend point third support improve change hundred little me benefit nation PM item black away how painting control","2.9"
"15","76","Thank wonder","1596","1981-09-05 23:55:54","Unit when quickly sister fast generation over them gas style","1.8"
"16","39","Expert close enough arrive allow","2281","1979-01-18 21:09:37","Why green as south anyone send improve firm relationship kind","3.6"
"17","261","Season religious plant","1476","1989-09-19 20:54:01","Somebody moment such tonight act drop through technology tell nation that mention black song range seven support","4.8"
"18","430","Speak exist nor","4751","1987-08-22 16:37:45","Music hot fund trouble name miss tough girl when store machine there","2.7"
"19","466","Again anyone allow hair few","17","1990-11-15 21:54:27","Little region field expect adult sense phone if everything listen perhaps note expect arm morning","3.7"
"20","36","Myself before there","4347","2021-05-03 13:33:06","South this race strong seem report activity store soldier such attorney raise teacher trial bed high dream wear important fund","3.9"
"21","500","Soldier society baby","3255","2010-07-21 04:45:36","Sing receive sing role environmental choose rather old grow him by matter audience","0.7"
"22","199","Behind most show strong","4280","2019-01-28 07:43:13","Address PM yet decision especially less rather staff talk administration fly model space lawyer draw","3.2"
"23","399","Range these","1771","1973-11-23 19:52:05","Design day hour Republican film image often face down south listen decision painting car section language sit","3.3"
"24","446","By strong group","354","1984-03-24 09:28:31","Scientist develop whether knowledge TV among to billion section represent third close claim son wonder","2.5"
"25","285","Through executive treatment","207","2006-02-27 13:50:46","Detail get fund tough everything whole answer thing stand trial best anyone remember common already day minute effect reduce whole","3.3"
"26","122","Nature thus too","3309","2022-04-13 05:37:21","By market cover local leave how east arm though right common happy free me actually population difference population technology","3.7"
"27","267","Rate statement matter","4323","1971-02-23 10:12:45","Across ago majority clearly this worry show order fill opportunity language new task","0.3"
"28","135","Indeed dream ago her","4508","1975-05-20 03:19:09","Structure bank mission whatever main protect analysis information call budget defense throughout","3.8"
"29","129","Tree oil outside","1229","1996-09-04 06:41:23","Share onto generation heart Mr news senior authority act part","4.8"
"30","221","Without cold theory beat","663","1970-01-29 10:26:47","Up voice level better yes team way your affect suffer he give agent simple pressure deal draw my financial","0.6"
"31","336","Policy stock keep hospital","2632","1985-10-24 14:57:29","Hospital far safe knowledge serious sort cut daughter another tough parent ground","3.9"
"32","14","Officer his","1006","2002-06-06 14:08:47","Feeling important happy should challenge future right so buy much yourself look save","1.9"
"33","54","Everybody put explain","501","2008-07-03 05:57:02","Allow six surface help use significant after either nature source sister professional attack body pass again party","0.1"
"34","97","Across owner example","3815","1976-11-09 22:13:20","Protect risk citizen second democratic rest wish arrive form artist sound use maintain process long leg side almost","3.6"
"35","38","Fear poor wish occur","217","1996-04-04 06:17:27","Important professional citizen yeah natural on industry statement Republican himself whom between none region sure ask peace ahead","2.4"
"36","318","Speak easy figure","1614","1991-04-15 21:03:15","How perform break defense pattern song year born throughout sure often throughout of man final rate story little old","3.0"
"37","404","Or many responsibility might as","3279","1993-10-04 19:25:49","Take late tell themselves really ready citizen mother require truth professor high her open special","3.1"
"38","83","Do blue","1995","1974-05-26 09:36:12","Million into debate near level class discuss across face window base writer after hear feel provide strong bar","0.1"
"39","18","Recent another heart","1982","2010-03-22 03:12:34","Tonight animal it product dark general student ok who race author religious such","2.0"
"40","171","Black moment","4170","2008-07-01 13:34:48","Young sound rich me add call situation could body concern customer opportunity within","3.2"
"41","329","Nor thing kid","3910","1979-12-08 04:05:42","Participant use fine modern again now inside night laugh news two more top seem model development television since","2.9"
"42","16","Term structure popular deal","1657","1993-11-25 22:17:23","Reach usually television compare then interest cause identify ask","3.9"
"43","76","High heart simply","4790","1993-01-24 14:55:07","Billion week whether respond have relationship news test service choose add effort often","3.7"
"44","42","South term public candidate worker","993","2004-08-17 19:14:23","Space public west sense join lay feeling perform travel become hair relationship position practice size staff national particularly push recognize will","4.3"
"45","433","Low interview perhaps who","3392","2013-07-06 09:26:57","Detail figure method eat industry suggest door everyone your institution nearly mean should perform it","4.2"
"46","124","Together example sing","39","2012-11-27 20:33:16","Much eye memory her although hour today war young executive month cause off wife position stuff for free camera drug over","0.1"
"47","477","Project big watch","4320","2005-01-10 09:11:15","It PM teach again serious quality religious agree animal public","2.4"
"48","143","Mind keep","201","1993-11-03 10:35:40","Sit operation service product while ever decade deal will despite catch","1.4"
"49","303","Institution hospital to from","1426","1992-12-16 07:44:25","Money success feeling building half support since ago scene join seem can about individual add involve final president recently","2.4"
"50","50","Clear receive nation","696","1974-01-24 05:05:12","Ready low worker manage main term nation own organization break follow with reason able mention moment","1.9"
"51","7","Song money east western","4820","1990-12-15 21:58:27","Look special effect bad drug especially let task provide drive scene fast follow realize audience our father","4.6"
"52","34","Feeling land computer really here","4483","1974-01-22 19:52:53","Job financial peace become option too these near pressure just night look","4.6"
"53","218","Beyond nice whatever","3572","1976-10-04 07:54:22","Him owner arrive find white police something skill fund remember","0.5"
"54","31","Alone computer hard","1828","1974-05-13 13:48:50","Everyone until happen else partner serious move religious girl with network sister under last fight campaign anyone sort","4.1"
"55","34","Miss clearly","571","1978-04-09 01:38:40","On song finish sell financial social eight us just girl enter hour car recognize give","0.1"
"56","202","College newspaper","5000","2010-09-22 21:24:35","And hot old mother add order describe floor growth think hand firm tough figure life miss from Republican throughout institution","3.2"
"57","485","Recent whether if heavy","827","1973-08-14 03:49:55","Produce some light school better instead sport resource either down data head color","4.7"
"58","447","Last market edge board","2487","2000-03-22 04:45:32","Because available trial sing choice direction special tree treat me","0.1"
"59","481","Song read","4222","1987-03-18 20:15:38","Represent important follow guess red school reduce focus free year answer industry white vote company next turn plan","1.1"
"60","56","Film may impact","2166","1974-10-23 17:22:04","Hope you project how movie subject future talk into","4.4"
"61","177","Forget material style since","2739","1985-12-26 16:28:50","Style feeling ten memory wonder quality guess letter experience hold wish","3.7"
"62","428","Individual popular yeah firm leave","3643","1978-04-12 01:58:25","We language star group country box organization amount full listen great water agent record election line born memory","3.8"
"63","350","Actually arm","3235","1999-04-20 11:58:30","Mean walk simple nor suddenly spend road within official than","2.5"
"64","92","Them dark huge discuss","471","2013-10-01 04:52:03","Early item attention only wonder message adult conference top debate hear","1.9"
"65","330","Skin discussion break particular","2061","1979-07-11 05:45:00","Prevent between material single machine herself issue decide deal serve despite Mr","1.5"
"66","400","Financial weight ball the","2121","1987-10-02 02:47:40","Them note sing this letter ago large laugh score apply beautiful","0.9"
"67","131","Daughter focus gas","4089","1980-05-22 13:05:12","Practice society national arrive until region popular their road would stock","3.9"
"68","188","Discuss interview class lay","1323","1999-04-28 18:21:41","Prepare senior these play left black design authority truth again station care instead site everybody three hour ball offer she","2.1"
"69","3","Investment girl story reflect","3371","1994-07-30 02:59:08","Before nearly science morning challenge town wear late who seven manage might","2.3"
"70","478","Choice agent whole become","3164","2015-04-13 11:03:04","Possible head claim apply important those mention certain card effort enough cell a foot out air","1.9"
"71","4","Form act book always more","1579","2022-03-16 07:35:26","Drug admit bit idea ability what treatment late chair type","1.0"
"72","117","Letter at early remember size","713","2008-11-26 03:11:06","Explain family fill big near bank entire the moment sport stuff plant trade much goal","2.7"
"73","362","Whatever force mention","2267","2000-03-07 17:46:10","Better to few few new both close can need wish","1.0"
"74","232","Along health may","942","2022-02-19 19:25:52","Identify others rather would fly interest performance something final standard issue way decade almost entire month recently","4.5"
"75","399","Behind reduce game","4608","1985-11-27 21:53:31","Finish million member service test during money serve clear sound","2.5"
"76","87","Street already wait capital","3702","2018-12-01 07:13:24","Indeed security pressure almost usually know sport per must yard wish interview region statement report enough","3.4"
"77","248","Reflect magazine","2489","2004-09-21 17:53:13","With senior charge fund area name think although administration","2.2"
"78","444","Early simply point garden they","3147","2003-05-07 05:06:12","Service according ask run wrong lose TV newspaper member","3.9"
"79","361","Face pay wonder","4222","2003-01-22 19:38:06","Mr oil woman expert economy husband citizen skin example modern say edge page action include","2.0"
"80","6","Lay catch main training","2054","1982-07-05 14:49:25","Individual listen real less executive give eye or policy","0.0"
"81","141","Inside imagine expert glass","4265","1998-11-09 19:35:23","Mission participant begin style expect attorney draw land high office support to various civil alone artist whom","0.5"
"82","128","Step establish attorney imagine","2919","2008-10-18 20:53:28","Pick ok environmental prove center coach that apply right third standard tough everyone month","1.4"
"83","220","Two between win drug","2576","2003-12-11 21:38:04","Bit structure ability night be establish north magazine by nation development particularly arrive drive","3.0"
"84","184","Tough view customer away","157","1991-09-13 22:05:07","Beautiful candidate represent tree nice fast use garden speak mention station do likely","4.7"
"85","465","Floor seek activity","4074","2016-06-13 05:25:31","Pull conference read cover machine improve particular consider body yes","4.0"
"86","76","Manage develop ago voice common","63","1984-06-28 08:00:16","Nor likely site traditional admit notice choice computer own here citizen finally true least table","4.5"
"87","489","Meet among say operation","1330","1999-06-12 05:16:16","Agree generation maintain drop chance decide raise wear plan arm","2.1"
"88","269","Capital education whatever play","708","1970-04-29 02:19:59","Quickly generation never popular avoid site school training successful everything forward management per necessary create understand half note allow week","4.7"
"89","350","South news","4778","2009-03-07 02:10:36","Wind already standard region loss claim none shake agree performance conference own figure traditional commercial beyond","3.0"
"90","111","Collection position speech","3585","2011-05-17 07:57:18","But situation national during good visit determine life pick inside responsibility marriage character democratic too imagine network expect","1.2"
"91","347","Energy lawyer vote","1660","2008-10-23 18:13:24","Another quickly general popular trip language girl language term","4.6"
"92","178","Than job health four you","1735","2011-04-13 13:03:35","Television word respond goal member break door church from Mr theory chance follow offer sometimes","2.8"
"93","17","Herself most up shake","2579","1974-07-10 14:58:27","International month whether drive break walk paper sport option fly card throughout","4.8"
"94","150","Level across","2906","1992-08-15 21:19:05","Policy or majority good future trial cut general computer event political quality control hour watch","3.6"
"95","368","Human him station assume","3802","2001-09-24 00:54:43","Why environmental begin herself behavior physical source news growth exist billion relationship apply memory senior song maintain","1.8"
"96","460","Collection customer must","3680","2007-03-03 13:25:18","Knowledge baby them fall mission foot soldier art know director parent television knowledge","0.1"
"97","137","Why only war herself major","3289","1985-01-10 16:13:36","Never commercial wonder help big give through itself common avoid instead","1.6"
"98","294","American radio","2521","2018-05-27 04:01:08","Thought blue quickly try surface quickly cost write fill seat series fast once attention produce event specific yourself","4.9"
"99","339","Education note road particularly magazine","2451","2004-12-14 16:59:33","Up coach listen house billion always remember our life condition week industry moment hotel","3.3"
